table_id,project_name,table_name,display_name,cohort_membership,entity_type,data_subjects,data_respondents,n_variables,n_rows,n_entities,last_updated
BiB_MeDALL.medall_quest,BiB_MeDALL,medall_quest,MeDALL Questionnaire,bib,participant,,,475,2594,2594,2024-05-14 09:13:13
BiB_MeDALL.medall_qd1,BiB_MeDALL,medall_qd1,MeDALL Questionnaire reactions to food,bib,participant,,,16,2604,2594,2024-05-14 09:13:11
BiB_MeDALL.medall_qd5,BiB_MeDALL,medall_qd5,MeDALL Questionnaire reactions to medicines,bib,participant,,,13,2598,2594,2024-05-14 09:13:11
BiB_MeDALL.medall_qd8,BiB_MeDALL,medall_qd8,MeDALL Questionnaire reactions to vaccines,bib,participant,,,13,2595,2594,2024-05-14 09:13:12
BiB_MeDALL.medall_skinprick,BiB_MeDALL,medall_skinprick,MeDALL skin prick,bib,participant,,,17,2269,2269,2024-05-14 09:13:13
BiB_MeDALL.medall_skinprick_qc,BiB_MeDALL,medall_skinprick_qc,MeDALL skin prick QC,bib,participant,,,14,228,228,2024-05-14 09:13:13
BiB_MeDALL.medall_greenspace,BiB_MeDALL,medall_greenspace,MeDALL Green Space Questionnaire,bib,participant,,,49,821,815,2024-05-14 09:13:11
BiB_MeDALL.medall_ngst,BiB_MeDALL,medall_ngst,MeDALL Neighbourhood Green Space Tool,bib,participant,,,115,3284,815,2024-05-14 09:13:11
BiB_MeDALL.medall_ndvi,BiB_MeDALL,medall_ndvi,MeDALL residential NDVI and green space,bib,participant,,,25,2451,2365,2024-05-14 09:13:11
